{
  "$id": "https://wg-serverless.org/workflow.schema.json",
  "$schema": "http://json-schema.org/draft-07/schema#",
  "description": "Serverless Workflow is a vendor-neutral specification for defining the model of workflows responsible for orchestrating event-driven serverless applications.",
  "type": "object",
  "extendsJavaClass": "io.cncf.serverlessworkflow.api.workflow.BaseWorkflow",
  "javaType": "io.cncf.serverlessworkflow.api.Workflow",
  "javaInterfaces": [
    "java.io.Serializable"
  ],
  "properties": {
    "id": {
      "type": "string",
      "description": "Workflow unique identifier",
      "minLength": 1
    },
    "name": {
      "type": "string",
      "description": "Workflow name",
      "minLength": 1
    },
    "description": {
      "type": "string",
      "description": "Workflow description"
    },
    "version": {
      "type": "string",
      "description": "Workflow version"
    },
    "schemaVersion": {
      "type": "string",
      "description": "Serverless Workflow schema version"
    },
    "dataInputSchema": {
      "type": "string",
      "description": "URI to JSON Schema that workflow data input adheres to"
    },
    "dataOutputSchema": {
      "type": "string",
      "description": "URI to JSON Schema that workflow data output adheres to"
    },
    "metadata": {
      "$ref": "metadata/metadata.json"
    },
    "expressionLanguage": {
      "type": "string",
      "description": "Default expression language to be used throughout the workflow definition"
    },
    "events": {
      "type": "array",
      "description": "Workflow event definitions. Defines events that can be consumed or produced",
      "items": {
        "type": "object",
        "$ref": "events/eventdef.json"
      }
    },
    "functions": {
      "type": "array",
      "description": "Workflow functions",
      "items": {
        "type": "object",
        "$ref": "functions/function.json"
      }
    },
    "states": {
      "type": "array",
      "description": "State Definitions",
      "items": {
        "type": "object",
        "existingJavaType": "io.cncf.serverlessworkflow.api.interfaces.State",
        "anyOf": [
          {
            "title": "Delay State",
            "$ref": "states/delaystate.json"
          },
          {
            "title": "Event State",
            "$ref": "states/eventstate.json"
          },
          {
            "title": "Operation State",
            "$ref": "states/operationstate.json"
          },
          {
            "title": "Parallel State",
            "$ref": "states/parallelstate.json"
          },
          {
            "title": "Switch State",
            "$ref": "states/switchstate.json"
          },
          {
            "title": "SubFlow State",
            "$ref": "states/subflowstate.json"
          },
          {
            "title": "Relay State",
            "$ref": "states/injectstate.json"
          },
          {
            "title": "ForEach State",
            "$ref": "states/foreachstate.json"
          },
          {
            "title": "Callback State",
            "$ref": "states/callbackstate.json"
          }
        ]
      }
    },
    "extensions": {
      "type": "array",
      "description": "Workflow Extensions",
      "items": {
        "type": "object",
        "existingJavaType": "io.cncf.serverlessworkflow.api.interfaces.Extension"
      }
    }
  },
  "required": [
    "id",
    "name",
    "version",
    "states"
  ]
}