{
  "id": "solvemathproblems",
  "version": "1.0",
  "name": "Solve Math Problems Workflow",
  "description": "Solve math problems",
  "functions": [
    {
      "name": "solveMathExpressionFunction",
      "resource": "functionResourse"
    }
  ],
  "states":[
    {
      "name":"Solve",
      "type":"foreach",
      "start": {
        "kind": "default"
      },
      "inputCollection": "$.expressions",
      "inputParameter": "$.singleexpression",
      "outputCollection": "$.results",
      "states": [
        {
          "name":"GetResults",
          "type":"operation",
          "start": {
            "kind": "default"
          },
          "actionMode":"sequential",
          "actions":[
            {
              "functionRef": {
                "refName": "solveMathExpressionFunction",
                "parameters": {
                  "expression": "$.singleexpression"
                }
              }
            }
          ],
          "end": {
            "kind": "default"
          }
        }
      ],
      "stateDataFilter": {
        "dataOutputPath": "$.results"
      },
      "end": {
        "kind": "default"
      }
    }
  ]
}