{
  "id": "VetAppointmentWorkflow",
  "name": "Vet Appointment Service Workflow",
  "description": "Vet service call via events",
  "version": "1.0",
  "events": [
    {
      "name": "MakeVetAppointment",
      "source": "VetServiceSoure",
      "kind": "produced"
    },
    {
      "name": "VetAppointmentInfo",
      "source": "VetServiceSource",
      "kind": "consumed"
    }
  ],
  "states": [
    {
      "name": "MakeVetAppointmentState",
      "type": "operation",
      "start": {
        "kind": "default"
      },
      "actions": [
        {
          "name": "MakeAppointmentAction",
          "eventRef": {
            "triggerEventRef": "MakeVetAppointment",
            "data": "$.patientInfo",
            "resultEventRef":  "VetAppointmentInfo"
          },
          "actionDataFilter": {
            "dataResultsPath": "$.appointmentInfo"
          },
          "timeout": "PT15M"
        }
      ],
      "end": {
        "kind": "default"
      }
    }
  ]
}