{
  "id": "finalizeCollegeApplication",
  "name": "Finalize College Application",
  "version": "1.0",
  "events": [
    {
      "name": "ApplicationSubmitted",
      "type": "org.application.submitted",
      "source": "applicationsource",
      "correlationToken": "applicantId"
    },
    {
      "name": "SATScoresReceived",
      "type": "org.application.satscores",
      "source": "applicationsource",
      "correlationToken": "applicantId"
    },
    {
      "name": "RecommendationLetterReceived",
      "type": "org.application.recommendationLetter",
      "source": "applicationsource",
      "correlationToken": "applicantId"
    }
  ],
  "functions": [
    {
      "name": "finalizeApplicationFunction",
      "type": "function",
      "resource": "finalizeApplicationResource"
    }
  ],
  "states": [
    {
      "name": "FinalizeApplication",
      "type": "event",
      "start": {
        "kind": "default"
      },
      "exclusive": false,
      "eventsActions": [
        {
          "eventRefs": [
            "ApplicationSubmitted",
            "SATScoresReceived",
            "RecommendationLetterReceived"
          ],
          "actions": [
            {
              "functionRef": {
                "refName": "finalizeApplicationFunction",
                "parameters": {
                  "student": "$.applicantId"
                }
              }
            }
          ]
        }
      ],
      "end": {
        "kind": "terminate"
      }
    }
  ]
}