{
  "id": "handleCarAuctionBid",
  "version": "1.0",
  "name": "Car Auction Bidding Workflow",
  "description": "Store a single bid whole the car auction is active",
  "functions": [
    {
      "name": "StoreBidFunction",
      "resource": "storeBidResource",
      "type": "function"
    }
  ],
  "events": [
    {
      "name": "CarBidEvent",
      "type": "carBidMadeType",
      "source": "carBidEventSource"
    }
  ],
  "states": [
    {
      "name": "StoreCarAuctionBid",
      "type": "event",
      "start": {
        "kind": "scheduled",
        "schedule": {
          "interval": "2020-03-20T09:00:00Z/2020-03-20T15:00:00Z"
        }
      },
      "exclusive": true,
      "eventsActions": [
        {
          "eventRefs": ["CarBidEvent"],
          "actions": [{
            "functionRef": {
              "refName": "StoreBidFunction",
              "parameters": {
                "bid": "$.bid"
              }
            }
          }]
        }
      ],
      "end": {
        "kind": "terminate"
      }
    }
  ]
}